companyName,storeName,contactName,telInfo,mailInfo,addressInfo,customerCenter,categoryName,productUrl
株式会社ヴァンクリーフ,MIBEAU official,永井進,+81-03-6303-1755,customer@van-cleef.jp,TOKYO SHIBUYA-KU EBISUMINAMI 1-11-15,"月~金：午前10時~午後5時
土日、祝日：休業",ビューティ,https://www.qoo10.jp/g/1172499524
"APR Co., Ltd.",APRILSKIN公式,Jiyoung,+81-03-6421-2850,qoo10_ap@apr-in.com,埼玉県 春日部市 緑町 6-9-21,,ビューティ,https://www.qoo10.jp/g/1147259677
"C&CN Co., Ltd.",BEAUSTA-Official,"C&CN Co., Ltd.",+81-03-6273-8934,beauselection@cncn.co.kr,"2F 47 Sindeok-ro, Ilsanseo-gu, Goyang-si, Gyeonggi-do, Republic of Korea","月~金曜日: 午前10時~午後6時
土日祝日:休業",ビューティ,https://www.qoo10.jp/g/803430496
THE FOUNDERS INC.,Anua Qoo10 公式,anua,+81-03-6447-2025,cs@anuashop.jp,"8F, 10F 521 Teheran-ro, Gangnam-gu, Seoul, Republic of Korea",,ビューティ,https://www.qoo10.jp/g/945527932
有限会社ファルコン,カラコンfarfar 2号店,内田,+81-03-6380-6191,farfar10@farcon.net,東京都渋谷区千駄ヶ谷 5-12-18 ノヴレスＭ1F,,ビューティ,https://www.qoo10.jp/g/835953298
株式会社RiseUP,モアコンタクト Qoo10店,朴夏奈,+81-0120-432-012,qoo10_support@morecon.jp,大阪府大阪市西区川口 2丁目2番17号　川口住倉ビルディング 8F,,ビューティ,https://www.qoo10.jp/g/1018441282
株式会社エース,カラコン通販クイーンアイズ Qoo10店,坂倉仁,+81-0120-267-531,info@queen-eyes.com,東京都 港区 麻布台 一丁目3番1号 麻布台ヒルズ森JPタワー17階,午前10時~午後6時,ビューティ,https://www.qoo10.jp/g/1094283659
株式会社華美,CICIBELLA　BEAUTY,,+81-070-9325-0349,cicibellabeauty@otoiawase.jp,千葉県船橋市西浦 3丁目1-3TN倉庫4階,,ビューティ,https://www.qoo10.jp/g/1167878665
粧美堂株式会社,粧美堂 ONLINE STORE,粧美堂株式会社,+81-03-5422-9666,info-qoo10@shobido-corp.co.jp,東京都 港区 港南品川インターシティＡ棟（２３階） 粧美堂株式会社,,ビューティ,https://www.qoo10.jp/g/1061500761
Marslabs Inc.,Baren Official,Marslabs Inc.,+81-?) 03-?) 1234-?),cx@marslabs.co.kr,"5662 9 Yeonmujang 13-gil, Seongdong-gu, Seoul, Republic of Korea","Monday to Friday: From 10:00 AM to 5:00 PM.
Saturday, Sunday, and Public holidays: Off.",ビューティ,https://www.qoo10.jp/g/1044200621
株式会社ライフケア・アクシス,コンタクトレンズのレンズワン,株式会社ライフケア・アクシス,+81-03-5335-7912,q-lensone@lifecare-axis.com,東京都 中野区 中野 4-10-2 中野セントラルパークサウス 6F,,ビューティ,https://www.qoo10.jp/g/839681712
リバースチェーンコンサルティング株式会社,カラコンショップ　カラコレ,リバースコンサルティング,+81-047-411-8207,re@rebirth10.co.jp,千葉県 八千代市 萱田 2214-54,,ビューティ,https://www.qoo10.jp/g/720605691
株式会社カトデン,HOTMART Qoo10店,加藤康任,+81-052-242-5777,info@hotmart.main.jp,愛知県名古屋市中区大須 3-14-43 第2 アメ横ビル2F,"月~金：午前10時~午後6時
土・日、定休日：休務",ビューティ,https://www.qoo10.jp/g/597851351
株式会社Lcode,コンタクトレンズのTeAmo,黒川浩輝,+81-0120-545-966,info@teacon.jp,東京都新宿区四谷 4-28-4YKBエンサインビル4F,"平日：午前10時~午後17時
土日祝日：午前10時~午後17時",ビューティ,https://www.qoo10.jp/g/694548248
株式会社ジー・ムーブ,Beauty shop LOOOK【国内発送】,株式会社ジー・ムーブ,+81-0120-113-438,info@loook.jp,大阪府箕面市船場東 2丁目7番2号2階,"月~金：午前10時~午後5時
土日、定休日：休務",ビューティ,https://www.qoo10.jp/g/1110958800
株式会社mira,Sophie & Branca,株式会社mira,+81-050-5369-5351,shop@mira-inc.jp,神奈川県中郡大磯町国府本郷 863-8,,ビューティ,https://www.qoo10.jp/g/1128916481
株式会社Ｌｃｏｄｅ,candy magic,南 真石,+81-0120-334-345,info@candymagic.jp,大阪府 大阪市中央区 久太郎町 3丁目4-28 センバフロント8F,,ビューティ,https://www.qoo10.jp/g/870516461
株式会社カズマ,アットコンタクト,福井　光,+81-0800-777-7777,atcontact-q10@atcl-haiso.jp,北海道札幌市中央区大通西 3丁目4番地1　明治安田生命札幌大通ビル5階,,ビューティ,https://www.qoo10.jp/g/508344435
ISAMOGU INC.,Celladix 公式ショップ,2359,+81-080-7527-3645,cs@celladix.co.kr,"4F 18 Hakdong-ro 23-gil Gangnam-gu Seoul, Republic of Korea",,ビューティ,https://www.qoo10.jp/g/1045306263
株式会社BJC,BJC公式ショップ,株式会社BJC,+81-080-4889-4632,bjc.ec@bjc-inc.com,福岡県福岡市博多区博多駅南 ４丁目１８-２ 明東ビル 4F,"月~金：10:00~17:00
土日祝：定休日",ビューティ,https://www.qoo10.jp/g/1095775229
株式会社GrandPrix,コンタクトレンズ通販のグランプリ,前田 浩明,+81-043-497-3389,contact@grandprix-co.com,千葉県八街市八街ほ 1032-26,"月~金：午前9時~午後17時
（土日祝:定休日）",ビューティ,https://www.qoo10.jp/g/904979206
株式会社　１－Ｄ　ＲＯＹＡＬ,1-D ROYAL,丸山知也,+81-073-402-4435,one_d_royal@zeru.co.jp,和歌山県和歌山市北ノ新地 １丁目３１,"平日：11:00～17:00(土:発送のみ)
定休日:日祝、年末年始、夏季他",ビューティ,https://www.qoo10.jp/g/785773660
株式会社Rise UP,BONANZA PARK,株式会社Rise UP,+81-0120-33-1251,qoo10_support@bonanza-park.jp,大阪府大阪市西区川口 2丁目2番17号川口住倉ビルディング,,ビューティ,https://www.qoo10.jp/g/818605261
大地の人株式会社,ink.,神野俊幸,+81-0120-440-899,info@129.co.jp,大阪府大阪市西区京町堀 1-6-23-4F,"月~金：午前9時30分~午後6時30分
定休日：土日祝",ビューティ,https://www.qoo10.jp/g/550004341
"TORRIDEN CO.,LTD.",Torriden Qoo10 公式ショップ,Torriden,+81-0285-37-8069,japan_ec@torriden.com,"26th 300 Olympic-ro, Songpa-gu, Seoul, Republic of Korea",,ビューティ,https://www.qoo10.jp/g/933241218
株式会社パレンテ,LENSFREE,今野沙織,+81-0120-147-272,,千葉県 千葉市中央区 問屋町 6-8,平日10:00～13:00、15:00~17:00,ビューティ,https://www.qoo10.jp/g/589743359
株式会社ピーピービージャパン,【公式】HapaKristin,,+81-03-6447-2282,japan@hapakristin.com,東京都 渋谷区 神宮前 1-13-18 原宿MMSビル,,ビューティ,https://www.qoo10.jp/g/1162881369
カラリン株式会社,ILYY lens,楠　雄司,+81-050-7109-6988,qoo10@colorin.jp,東京都大田区田園調布 1-13-29-106,,ビューティ,https://www.qoo10.jp/g/1076888396
BENOW INC.,ナンバーズイン韓国公式 numbuzin,Benow,+81-03-6258-0328,cs_numbuzinjp@benow.co.kr,", benow Inc (4F), GT Tower 411 Seocho-daero, Seocho-gu, Seoul, Republic of Korea",,ビューティ,https://www.qoo10.jp/g/1188351647
アモーレパシフィックジャパン株式会社,AESTURA公式ショップ,AESTURA　ECチーム,+81-080-3502-7659,,東京都 渋谷区 広尾 一丁目13番7号,,ビューティ,https://www.qoo10.jp/g/1079609281
株式会社コスメパーク,ビューティプロ,Takahashi Yusuke,+81-050-5276-9629,q10@globalcosmetics.jp,大阪府 大阪市北区 梅田 １丁目２番２号大阪駅前第２ビル２階５－６号室,,ビューティ,https://www.qoo10.jp/g/1165501463
株式会社レンズラボ,レンズラボ 【コンタクト通販】,LENS LABO CO.Limited,+81-0120-369-222,info@lens-labo.com,WORLDWIDE HOUSE19 21F HONG KONG ISLAND CENTRAL DES VOEUX ROAD CENTRAL,"平日：10：00-17：00
土、日、祝日、店舗休業日：定休日",ビューティ,https://www.qoo10.jp/g/615945784
株式会社RiLiSh,RiLiShストア,瀧本琢真,+81-080-8914-2258,info@rilish.co.jp,東京都 港区 港南 2-16-1品川イーストワンタワー4階,,ビューティ,https://www.qoo10.jp/g/1179624401
株式会社フィッツコーポレーション,LOVE PASSPORT SINORU_official,,+81-080-3732-4141,qoo10-lppsinoru@fits-you.com,東京都港区北青山 3-6-1 オーク表参道ビル 7階,,ビューティ,https://www.qoo10.jp/g/1190305897
アモーレパシフィックジャパン㈱,エチュード 日本公式ストア,エチュードデジタルコマース,+81-0120-964-968,onlineshop@etude.jp,東京都渋谷区広尾 １－１－３９　恵比寿プライムスクエア１８階,,ビューティ,https://www.qoo10.jp/g/755365666
株式会社NISSO,アリアナ　ショップ,奥村歩美,+81-03-6384-1387,ariana@nisso-cosme.com,埼玉県川口市安行原 1381-1,"月~金：午前10時~午後3時
土日祝日：お休み",ビューティ,https://www.qoo10.jp/g/1191434559
株式会社ARIOSE,LILY ANNA,畑　祐輔,+81-03-6417-0109,info-qoo10@lilyanna.jp,東京都品川区大崎 1-2-2アートヴィレッジ大崎セントラルタワー10階,,ビューティ,https://www.qoo10.jp/g/709597394
株式会社ESK,saes-company,s,+81-086-236-7724,saes-company@tiny-usa-6126.icurus.jp,岡山県 岡山市南区 福富中 1丁目7-10,,ビューティ,https://www.qoo10.jp/g/1137829517
株式会社アイ・アンド・アイ,アイプラス,姉川和憲,+81-092-555-2477,eyeplus@water.ocn.ne.jp,福岡県福岡市南区清水 3丁目20-24,"月～金：10：00～17：00
店休日：土曜・日曜・祝祭日",ビューティ,https://www.qoo10.jp/g/722364906
株式会社アイネクスト,eye palette,,+81-052-433-7201,eyepalette@eye-next.co.jp,愛知県名古屋市中村区名駅 1-1-1　JPタワー名古屋21F,"平日：11:00～15:00
土日祝日：定休日",ビューティ,https://www.qoo10.jp/g/1160728939
TIRTIR.Inc,TIRTIR OFFICIAL,TIRTIR,+81-3-5937-0347,,東京都 港区 東麻布 1丁目28－12 VORT麻布Maxim 4F 株式会社ティルティルジャパン,,ビューティ,https://www.qoo10.jp/g/879782162
株式会社スウィート,カラコンプラス Qoo10店,萱間 昌徳,+81-06-6265-0878,info-q@sweet78.co.jp,大阪府大阪市中央区博労町 2-2-13 大阪堺筋ビル4F,"【問い合わせ対応】
月～金曜 11～17時
※定休日：土日祝",ビューティ,https://www.qoo10.jp/g/856422444
株式会社ＳＵＩ,SUI,株式会社ＳＵＩ,+81-0729-64-6669,,大阪府東大阪市吉田 1-9-14,,ビューティ,https://www.qoo10.jp/g/1151325592
株式会社H2O,ululis・∭・&Prism公式SHOP,株式会社H2O,+81-070-8992-3189,h2o.ecmall@gmail.com,東京都港区南青山 5丁目6番26青山246ビル9階10階,"月~金：午前 10時 ~ 午後 5時
土日祝：休務",ビューティ,https://www.qoo10.jp/g/1014601960
Hamee株式会社,【公式】ByUR,中谷力也,+81-0120-569-565,byur_qoo10@contact.jp.iface.com,神奈川県 小田原市 栄町 2-12-10 Square O2,"月~金：11時~16時
土・日・祝日：定休日",ビューティ,https://www.qoo10.jp/g/1004072090
エフエムジー＆ミッション株式会社,VDL 公式ショップ,エフエムジー＆ミッション株式会社,+81-0120-117-311,qoo10-cs@lg-beauty.jp,東京都港区新橋 1-5-1,,ビューティ,https://www.qoo10.jp/g/1034222802
株式会社Snatch  Wacko,CZEL,,+81-070-4319-5087,endou_isamu@sumiboshi.jp,TOKYO SHINJUKU-KU HYAKUNINCHO 1-22-3,,ビューティ,https://www.qoo10.jp/g/1162234928
株式会社maution,maution beauty,株式会社maution,+81-086-697-6232,info@maution.co.jp,岡山県 倉敷市 片島町 91-3,,ビューティ,https://www.qoo10.jp/g/1038587394
株式会社Global Style Japan,【安心国内発送】コスメイティブ　コスメ＆ヘアケア専門店,城崎,+81-06-6423-8114,info@gs-jpn.com,兵庫県尼崎市七松町 1-20-23 AKCビル2F,,ビューティ,https://www.qoo10.jp/g/1095055060
EXTREME Inc,エクストリーム公式ショップ,EXTREME Inc,+81-?) 03-?) 1234-?),global@extreme.co.kr,"3F Trees Building, 727, Eonju-ro, Gangnam-gu, Seoul, Republic of Korea 727 Eonju-ro, Gangnam-gu, Seoul, Republic of Korea","月~金：午前10時~午後6時
土：午前9時~午後1時
日、定休日：休務",サプリ・ダイエット,https://www.qoo10.jp/g/1159007079
マザーリーフヤクヒン,母の葉薬品,株式会社マザーリーフ薬品,+81-06-6543-3105,motherleaf@xqg.biglobe.ne.jp,大阪府大阪市西区西本町 1-13-38西本町新興産ビル4F,,サプリ・ダイエット,https://www.qoo10.jp/g/612104239
DOTS CORPORATION Inc,Canteen9 公式,カンティーンナイン,+81-050-5806-2504,canteen9_japan@dotscorporation.com,"STXV Tower 2F 203 128 Gasan digital 1-ro, Geumcheon-gu, Seoul, Republic of Korea","月~金: 午前 9時~午後 6時
土、日、祝日：休務",サプリ・ダイエット,https://www.qoo10.jp/g/1029493773
株式会社スピック,Lypo-C公式ショップ Qoo10店,鈴木 亮太,+81-0120-663-337,ecsupport-qoo10-lypoc@spic.com,神奈川県 鎌倉市 雪ノ下 3-3-23,,サプリ・ダイエット,https://www.qoo10.jp/g/1134764266
"FNCORPORATION CO.,LTD.",pretea_official,JANG KYU YEUN,+81-?) 03-?) 1234-?),,"440 100, Sinusil-ro, Hanam-si, Gyeonggi-do, Republic of Korea, Republic of Korea",,サプリ・ダイエット,https://www.qoo10.jp/g/1144936976
株式会社エフ琉球,【公式】サプリ専門店 シードコムス Qoo10モール店,長濱諒,+81-098-963-9076,,沖縄県那覇市泊 2丁目1番21号尚平ビル1階,月~金：10:30～12:00/13:00～15:00(土・日・祝日除く),サプリ・ダイエット,https://www.qoo10.jp/g/788728464
Happytree,Happytreemall,Happytree,+81-?) 03-?) 1234-?),,"601Dong 201Ho 134-1 Hyeonam-ro, Suji-gu, Yongin-si, Gyeonggi-do, Republic of Korea",,サプリ・ダイエット,https://www.qoo10.jp/g/1193737983
株式会社ALBONA,monomo公式ショップ,田中,+81-090-7815-3890,qoo10-support@i-shoten.com,東京都 渋谷区 道玄坂 1丁目20-8  寿パークビル4階,,サプリ・ダイエット,https://www.qoo10.jp/g/1097671463
"ELOOMBIO CO.,LTD",Dr. Choi’s Solution(ドクター·チョイス),Dr. Choi's Solution,+81-?) 03-?) 1234-?),albert@eloombio.com,"1217ho, 83, Samwon-ro Gyeonggi-do Deogyang-gu, Goyang-si, Republic of Korea","月~金：午前 10時~午後 5時
土, 日、定休日：休務",サプリ・ダイエット,https://www.qoo10.jp/g/1064719092
株式会社サンタナトレーディング,ビューストア,田中,+81-084-973-3081,santanarose@netsjpn.com,広島県福山市御門町 3-5-8経済リポートビル２F,"月~金：午前10時~午後5時
土日祝はお休み",サプリ・ダイエット,https://www.qoo10.jp/g/793613852
キセキ株式会社,美のくらし便,,+81-03-6458-0575,,東京都葛飾区東新小岩 ８ー４１ー３　ＢＵＮＧＥＮビル２階,,サプリ・ダイエット,https://www.qoo10.jp/g/1186599809
株式会社韓国高麗人参社,cosme Re:Make 公式ショップ,cosme-remake,+81-03-6279-3606,support_remake@koraininginsha.jp,東京都新宿区西早稲田 １丁目２３−５ Re:MAKE WasedaⅡ,,サプリ・ダイエット,https://www.qoo10.jp/g/1136635557
株式会社BANPUP,まるごと巨峰くん,,+81-03-5789-5847,info@banpup.com,東京都渋谷区恵比寿恵比寿ガーデンプレイス 東京都渋谷区恵比寿4-20-3恵比寿ガーデンプレイスタワー18階,,サプリ・ダイエット,https://www.qoo10.jp/g/1157662181
株式会社ユーフォリア,ひざまくら,阿部,+81-03-5830-6531,shop@show-riki.com,東京都台東区上野 6丁目1番6号御徒町グリーンハイツ1005,,サプリ・ダイエット,https://www.qoo10.jp/g/1175684787
株式会社ウィーズ,ベストＨＢＩ（ドラッグイチワタ皆野バイパス店）,株式会社イチワタ,+81-0494-26-5213,best.hbi2017q10@gmail.com,埼玉県秩父郡皆野町皆野 775,"月~金：午前10時~午後5時
土、日、祝日：休務",サプリ・ダイエット,https://www.qoo10.jp/g/797620157
株式会社カワラヤ,カワラヤドラッグQoo10店,株式会社カワラヤ,+81-06-6643-9088,info@kwryjp.com,大阪府 大阪市浪速区 恵美須西 2-6-9 1F,"月~金：午前9時~午後18時
土日、定休日：休務",サプリ・ダイエット,https://www.qoo10.jp/g/1101858232
リバティライフ株式会社,LzShop-Qoo10店,箕浦,+81-050-6860-6949,yuusunshine@gmail.com,岐阜県山県市高富 2114-1,,サプリ・ダイエット,https://www.qoo10.jp/g/867253332
株式会社NOSC,Mydiine,株式会社NOSC,+81-03-4565-0010,common@cs-fom.com,東京都 新宿区 新宿 2丁目3番11号VORT新宿御苑4F,"月~金：午前10時~午後6時
土日祝、定休日：休務",サプリ・ダイエット,https://www.qoo10.jp/g/1129993486
"NATURELOUD CO.,LTD.",イヨンエの健康美食 公式ショップ,natureloud,+81-?) 03-?) 1234-?),jp@natureloud.co.kr,"F20 332 Teheran-ro, Gangnam-gu, Seoul, Republic of Korea","月～金：午前10時～午後6時
土、日、祝日：休業",サプリ・ダイエット,https://www.qoo10.jp/g/1133391877
キムサンウン,AP,KSE,+81-080-7716-3568,,東京都大田区石川町 2-1-3,"Mon-Fri: 9am-10pm
Sat: 9am to 11pm
Sundays and public holidays: Closed",サプリ・ダイエット,https://www.qoo10.jp/g/1085159211
武内製薬株式会社,武内製薬公式ショップBEAUTY CART,小倉 由渡,+81-03-6721-7130,repica@kinpica.jp,東京都 品川区 西五反田 1丁目18番9号5階,"月~金：午前9時~午後5時
土、日、定休日：休務",サプリ・ダイエット,https://www.qoo10.jp/g/1135961622
"DS NATURE Co.,LTD",Dalsim公式,YANG HOON CHANG,+81-?) 03-?) 1234-?),japan@dalsim.kr,"3F, DS NATURE 20 Sangmunuri-ro, Seo-gu, Gwangju, Republic of Korea",,サプリ・ダイエット,https://www.qoo10.jp/g/1053144197
"TGRN CO., LTD.",GRN+ Official shop,Yoonhi LEE,+81-?) 03-?) 1234-?),,"Banghak-dong 676-21 b2 Seoul Dobong-gu, Republic of Korea",,サプリ・ダイエット,https://www.qoo10.jp/g/1133825301
株式会社KINS,KINS 公式ストア,株式会社KINS,+81-03-4580-2285,,東京都江東区新木場 1-17-8　三井リンクラボ新木場2　328号室,"月~金：午前10時~午後6時
土日祝：休み",サプリ・ダイエット,https://www.qoo10.jp/g/1153239128
リプサ株式会社,サプリメント通販専門店 リプサ,服部武久,+81-0995-29-5037,qoo10@lipusa.co.jp,鹿児島県伊佐市菱刈南浦 2679,"月~金：午前9時~午後5時
(土・日・祝日)：定休日",サプリ・ダイエット,https://www.qoo10.jp/g/1055143604
"THE PLUS INTERACTIVE CO.,LTD.",Shake Baby 公式ショップ,"THE PLUS INTERACTIVE CO.,LTD.",+81-?) 03-?) 1234-?),shakebaby.jp@gmail.com,"3F 14 Teheran-ro 19-gil, Gangnam-gu, Seoul, Republic of Korea","月~金：午前10時~午後6時
土、日、休日：休務",サプリ・ダイエット,https://www.qoo10.jp/g/978476852
阪神酒販株式会社,ぐぃぐぃドリンク,西野順一,+81-050-5371-7612,gmarket@drinkshop.biz,兵庫県神戸市兵庫区吉田町 2-13-6,"受付時間：10～12時・13～17時
受付日：※平日【月～金】のみ
土、日、祝祭日：休務",サプリ・ダイエット,https://www.qoo10.jp/g/537877572
嘉日株式会社,(資生堂、コーセー正規取扱店)オリエントストア,嘉日株式会社,+81-03-5295-2508,oriennto_0901@yahoo.co.jp,東京都千代田区神田佐久間町 1-8-4ﾆｭｰ千代田ビル１－２F,,サプリ・ダイエット,https://www.qoo10.jp/g/1101318026
PPYC BIO INC.,SUNMANC 公式ショップ,SUNMANC,+81-?) 03-?) 1234-?),sales@ppycbio.com,"Gwangjin-gu, Seoul, Republic of Korea 2F A113, 75, Neungdong-ro 13-gil,, Republic of Korea",平日午前10時~6時,サプリ・ダイエット,https://www.qoo10.jp/g/1187868861
夏木株式会社,MOSOストア,MOSOストア,+81-06-6770-9005,info@natsuki-cosme.com,大阪府大阪市東成区東中本 1-8-13,,サプリ・ダイエット,https://www.qoo10.jp/g/1122247314
ＹＩＹＩ株式会社,吉吉家,松本麻衣,+81-080-5139-8261,tikuhi2008@gmail.com,福岡県福岡市南区塩原 1丁目22番18,,サプリ・ダイエット,https://www.qoo10.jp/g/1194422965
Eve株式会社,御三家,合同会社andY,+81-080-7067-7676,qoo10@andy1228.jp,東京都町田市野津田町 120-1,"月~金：午前9時~午後6時
土：午前9時~午後1時
日、定休日：休務",サプリ・ダイエット,https://www.qoo10.jp/g/1131601363
株式会社Ultimate Life,GronGSHOP,田中 久登,+81-079-280-2324,libertashop-qoo10@ultimatelife.co.jp,兵庫県 姫路市 御国野町御着 351 （荷物返送先住所）,"平日10:00～17:00
（土日祝休業日）",サプリ・ダイエット,https://www.qoo10.jp/g/636233634
LUCKYCART,LUCKYCART.,岡成明,+81-070-1066-9104,,栃木県 大田原市 城山 1-6-35,,サプリ・ダイエット,https://www.qoo10.jp/g/1134788911
ウェルモット製薬株式会社,ウェルモット製薬  Qoo10公式ショップ,大山拓也,+81-0120-792-760,support@wellmotto.jp,東京都 国分寺市 本町 2-11-5矢野ビル504号室,,サプリ・ダイエット,https://www.qoo10.jp/g/629673094
株式会社スリーピース,VITAS Qoo10店,株式会社スリーピース,+81-03-6812-1093,q10@three-peace.tokyo,東京都豊島区南池袋 3-13-5池袋サザンプレイス6F,"平日： AM11:00〜PM17:00
定休日：土曜・日曜・祝日",サプリ・ダイエット,https://www.qoo10.jp/g/1108507752
赤坂莉空,アイシーエーショップ,,+81-070-9301-7603,,北海道札幌市北区北十八条西 6丁目3番3-303号,,サプリ・ダイエット,https://www.qoo10.jp/g/1163761837
松田侑也,くらしの音色,,+81-080-6163-8606,,北海道札幌市手稲区前田八条 19-6-20,,サプリ・ダイエット,https://www.qoo10.jp/g/1194815028
三皇ドリーム株式会社,ビーティー,三皇ドリーム株式会社,+81-054-553-1311,yu-dream@ab.thn.ne.jp,静岡県富士市国久保 1-10-28-3号,,サプリ・ダイエット,https://www.qoo10.jp/g/748779764
株式会社エイチ・ジェイ・インターナショナル,BEAUTYON,株式会社エイチ・ジェイ・インターナショナル,+81-080-7164-9488,hjintern@outlook.jp,東京都 町田市 図師町 1335-1 ライオンズガーデン町田の丘311,,サプリ・ダイエット,https://www.qoo10.jp/g/1103548394
株式会社ＢＵＮＧＥＮ,お得コスメQoo10店,株式会社ＢＵＮＧＥＮ,+81-070-9247-1509,qoo10-8@bungengroup.com,東京都 葛飾区 東新小岩 ８ー４１ー３　ＢＵＮＧＥＮビル１階,,サプリ・ダイエット,https://www.qoo10.jp/g/1146558321
合同会社森と湖,美しい山,,+81-070-9288-8723,,大阪府大阪市中央区本町 ４丁目８番１号ＳＤ本町ビル７０２号,,サプリ・ダイエット,https://www.qoo10.jp/g/1162796727
株式会社すくなび,SUKUNABI SHOP,宮城慎一,+81-070-2291-8172,miyagi@sukunabi.com,福井県敦賀市吉河 41-1-22,,サプリ・ダイエット,https://www.qoo10.jp/g/1137520792
Hiroshopnet,hiro shop net 2025,,+81-080-8805-0444,,栃木県那須塩原市埼玉 168-38,,サプリ・ダイエット,https://www.qoo10.jp/g/1194561416
株式会社Q美ワールド,【公式】conodo コノド 高濃度コスメ研究所,中土陽介,+81-06-7668-0212,info@be-garden.com,大阪府 大阪市生野区 巽北 1-8-6,"月~金：午前9時30分~午後6時
土、日、祝：休店日",サプリ・ダイエット,https://www.qoo10.jp/g/1096909333
株式会社逸美商事,コスメセブン,ロダイイ,+81-070-9329-1318,qoo10-i@daiki-s.com,愛知県尾張旭市西山町 2-1-4(2F),"月~金：午前9時~午後6時
土：午前9時~午後1時
日、定休日：休務",サプリ・ダイエット,https://www.qoo10.jp/g/1111076947
"Limoe Co., Ltd.",LIMOE,Kimhyochan,+81-070-9126-3686,support@limoe-jp.com,"805-46, 8F, Woosung SB Tower 385 Gangseo-ro, Gangseo-gu, Seoul, Republic of Korea",,サプリ・ダイエット,https://www.qoo10.jp/g/1030617275
株式会社ファンケル,FANCL公式ショップ Qoo10店,株式会社ファンケル,+81-0120-77-6887,info-q@fancl.co.jp,神奈川県 横浜市中区 山下町 89番地1,"受付時間：朝9時～夕方5時
※年末年始を除く",サプリ・ダイエット,https://www.qoo10.jp/g/868163348
澤田和志,Colo-Colo Shop,Kaz SW,+81-090-4420-0846,,東京都北区滝野川 1-90-14-203,,サプリ・ダイエット,https://www.qoo10.jp/g/1090404741
ユーハ味覚糖株式会社,【公式】UHA味覚糖 Qoo10ショップ,鈴木綾,+81-080-6226-8087,uha-shop@uha-mikakuto.co.jp,大阪府 大阪市中央区 神崎町 4-12,,サプリ・ダイエット,https://www.qoo10.jp/g/1135799452
株式会社ハーブ健康本舗,ハーブ健康本舗 Qoo10店,徳永栄二,+81-0120-963-882,,福岡県福岡市中央区大名 1-1-15,,サプリ・ダイエット,https://www.qoo10.jp/g/1108769594
LOWA INC.,LOWA,Elisha Ko,+81-?) 03-?) 1234-?),,La Palma CA 8677 Windsor Cir,,サプリ・ダイエット,https://www.qoo10.jp/g/1174354420
バブルスター株式会社,LOHAStyleお手軽食品館,小倉由渡,+81-046-211-9003,ec@senzu.info,神奈川県大和市代官 1-15-15,"月～金：10時～17時
土・日・祝日日：店休日",サプリ・ダイエット,https://www.qoo10.jp/g/627536902
hi-k,Heiss,茅野秀和,+81-080-3799-1464,hik155828@gmail.com,兵庫県芦屋市高浜町 4-2-812,"月~金：午前11時~午後5時
土・日・祝祭日　店休日",サプリ・ダイエット,https://www.qoo10.jp/g/702382111
株式会社エクセレントメディカル,エクセレントメディカル Qoo10,和田 有司,+81-0120-39-9922,info_q10@ex-medical.com,福井県福井市文京 2-17-33,"月~金：午前9時~午後6時
土、日、祝日：休業",サプリ・ダイエット,https://www.qoo10.jp/g/1101608455
合資会社ゴトウ薬局,ライラック薬局,ゴトウ薬局,+81-052-981-0020,info@gotouphm.jp,愛知県名古屋市北区清水 5-25-2,,サプリ・ダイエット,https://www.qoo10.jp/g/630683744
